<?xml version="1.0"?>
<!-- User Creation Workflow -->
<workflow
	xmlns:xsi="http://www.w3.org/2001/XMLSchema-instance"
	xsi:noNamespaceSchemaLocation="https://schema.flowcentralplatform.com/xsd/4.2.0/flowcentral-workflow.xsd"
	name="userCreation"
	description="$m{security.workflow.usercreation}"
	label="$m{security.workflow.usercreation.label}" entity="user" published="true" runnable="true">
	<steps>
		<step type="START" name="start"
			description="$m{security.workflow.usercreation.step.start}"
			label="$m{security.workflow.usercreation.step.start.label}"
			nextStep="approval">
			<setValues>
				<setValue field="workflowStatus" value="AWA" />
			</setValues>
		</step>
		<step type="USER_ACTION" name="approval"
			description="$m{security.workflow.usercreation.step.approval}"
			label="$m{security.workflow.usercreation.step.approval.label}"
			applet="security.manageUser">
			<alerts>
				<alert name="userCreationApproval"
					description="$m{security.workflow.usercreation.alert.approval}"
					type="USER_INTERACT"
					generator="usercreation-alertsender" />
			</alerts>
			<userActions>
				<userAction name="approveUserCreate"
					description="$m{security.workflow.usercreation.useraction.approve}"
					label="$m{security.workflow.usercreation.useraction.approve.label}"
					nextStep="prepareCreateUser" highlight="GREEN" />
				<userAction name="declineUserCreate"
					description="$m{security.workflow.usercreation.useraction.decline}"
					label="$m{security.workflow.usercreation.useraction.decline.label}"
					nextStep="deleteUser" highlight="RED" />
			</userActions>
		</step>
		<step type="ENRICHMENT" name="prepareCreateUser"
			description="$m{security.workflow.usercreation.step.prepare}"
			label="$m{security.workflow.usercreation.step.prepare.label}"
			nextStep="createUser" policy="usercreation-enrichment">
		</step>
		<step type="RECORD_ACTION" name="createUser"
			description="$m{security.workflow.usercreation.step.creation}"
			label="$m{security.workflow.usercreation.step.creation.label}"
			nextStep="end" actionType="UPDATE">
			<setValues>
				<setValue field="workflowStatus" value="APR" />
			</setValues>
			<alerts>
				<alert name="userWelcome"
					description="$m{security.workflow.usercreation.alert.welcome}"
					type="PASS_THROUGH"
					generator="userwelcome-alertsender"
					recipientPolicy="entity-wfrecipientpolicy"
					recipientNameRule="fullName" recipientContactRule="email" />
			</alerts>
		</step>
		<step type="RECORD_ACTION" name="deleteUser"
			description="$m{security.workflow.usercreation.step.deletion}"
			label="$m{security.workflow.usercreation.step.deletion.label}"
			nextStep="end" actionType="DELETE">
		</step>
		<step type="END" name="end"
			description="$m{security.workflow.usercreation.step.end}"
			label="$m{security.workflow.usercreation.step.end.label}" />
		<step type="ERROR" name="error"
			description="$m{security.workflow.usercreation.step.error}"
			label="$m{security.workflow.usercreation.step.error.label}"
			applet="security.manageUser">
			<setValues>
				<setValue field="workflowStatus" value="ERR" />
			</setValues>
			<userActions>
				<userAction name="recover"
					description="$m{security.workflow.usercreation.useraction.recover}"
					label="$m{security.workflow.usercreation.useraction.recover.label}"
					nextStep="approval" highlight="ORANGE" />
			</userActions>
		</step>
	</steps>
</workflow>